,course_name,course_rating,earn_skills,course_link,institution,metadata
411,The Manager's Toolkit: A Practical Guide to Managing People at Work,4.7,"Skills you'll gain: Human Resources, Leadership and Management, People Management, Conflict Management, Decision Making, Human Resources Operations, People Analysis, Performance Management, Recruitment, Business Analysis, Employee Relations, Leadership Development, Organizational Development, People Development",https://www.coursera.org/learn/people-management,University of London,Mixed Course 1 - 3 Months
412,SAS Programmer,4.7,"Skills you'll gain: SAS (Software), Data Analysis, Statistical Programming, Data Analysis Software, Computer Programming, Statistical Analysis, Programming Principles, Data Management, Data Structures, Exploratory Data Analysis, Databases, SQL, Process Analysis, Computational Logic",https://www.coursera.org/professional-certificates/sas-programming,SAS,Beginner Professional Certificate 3 - 6 Months
413,Microsoft Azure Developer Associate (AZ-204),4.7,"Skills you'll gain: Microsoft Azure, Cloud Computing, Cloud Applications, Cloud Management, Cloud Platforms, Cloud Storage, Cloud Engineering, Cloud-Based Integration, Application Development, Computer Programming, Software Security, Web Development, Data Management, DevOps, System Security, Databases, Software Engineering, Computer Networking, Data Structures, Store Management, Network Architecture, Network Security, Linux, Communication",https://www.coursera.org/professional-certificates/azure-developer-associate,Microsoft,Intermediate Professional Certificate 3 - 6 Months
414,Practical Guide to Trading,4.7,"Skills you'll gain: Finance, Investment Management, Financial Analysis, Leadership and Management, Risk Management, Securities Trading, Financial Management, Market Analysis, Strategy, Strategy and Operations, Business Analysis, Accounting, Data Analysis, Securities Sales, Taxes",https://www.coursera.org/specializations/financial-instruments-trading-investing,Interactive Brokers,Beginner Specialization 3 - 6 Months
415,Child Nutrition and Cooking,4.7,,https://www.coursera.org/learn/childnutrition,Stanford University,Beginner Course 1 - 3 Months
416,Advanced Digital Transformation,4.7,,https://www.coursera.org/specializations/advanced-digital-transformation-iima,IIMA - IIM Ahmedabad,Intermediate Specialization 3 - 6 Months
417,Futures Thinking,4.7,"Skills you'll gain: Adaptability, Creativity, Forecasting, Critical Thinking, Innovation, Human Learning, Decision Making, Strategy, Problem Solving, Collaboration, Communication, People Analysis, Planning, Research and Design, Scientific Visualization, Strategy and Operations, Emotional Intelligence, Business Transformation, Storytelling, Virtual Reality, Game Theory, Design and Product, Visualization (Computer Graphics), Leadership Development",https://www.coursera.org/specializations/futures-thinking,Institute for the Future,Beginner Specialization 3 - 6 Months
418,International Humanitarian Law in Theory and Practice,4.7,,https://www.coursera.org/learn/international-humanitarian-law,Universiteit Leiden,Beginner Course 1 - 3 Months
419,Introduction to Data Engineering,4.7,"Skills you'll gain: Data Engineering, Data Management, Extract, Transform, Load, Databases, Network Security, Big Data, Data Warehousing, Leadership and Management, SQL, Data Science, NoSQL",https://www.coursera.org/learn/introduction-to-data-engineering,IBM,Beginner Course 1 - 4 Weeks
420,Data Science Foundations: Statistical Inference,4.4,"Skills you'll gain: Probability & Statistics, General Statistics, Probability Distribution, Estimation, Statistical Tests, Mathematics, Calculus, Correlation And Dependence",https://www.coursera.org/specializations/statistical-inference-for-data-science-applications,University of Colorado Boulder,Intermediate Specialization 3 - 6 Months
421,Machine Learning Data Lifecycle in Production,4.4,"Skills you'll gain: Python Programming, Statistical Programming, Tensorflow, Exploratory Data Analysis, Feature Engineering, Machine Learning, Probability & Statistics",https://www.coursera.org/learn/machine-learning-data-lifecycle-in-production,DeepLearning.AI,Advanced Course 1 - 4 Weeks
422,Healthcare IT Support,4.4,"Skills you'll gain: Problem Solving, Communication, Customer Support",https://www.coursera.org/specializations/healthcare-it,Johns Hopkins University,Beginner Specialization 3 - 6 Months
423,Reducing Gun Violence in America: Evidence for Change,4.4,Skills you'll gain: Exploratory Data Analysis,https://www.coursera.org/learn/gun-violence,Johns Hopkins University,Beginner Course 1 - 3 Months
424,Web Applications for Everybody,4.4,"Skills you'll gain: Database Design, Databases, HTML and CSS, Javascript, SQL, Web Development",https://www.coursera.org/specializations/web-applications,University of Michigan,Intermediate Specialization 3 - 6 Months
425,Decentralized Finance (DeFi): The Future of Finance,4.4,"Skills you'll gain: BlockChain, FinTech, Finance, Algorithms, Cryptography, Payments, Banking, Risk Management, Contract Management, Computational Logic, Regulations and Compliance, Securities Trading, Data Mining, Strategy and Operations, Cyberattacks, Financial Analysis, Investment Management, Security Engineering",https://www.coursera.org/specializations/decentralized-finance-duke,Duke University,Intermediate Specialization 3 - 6 Months
426,AWS Cloud Practitioner Essentials,4.4,"Skills you'll gain: Amazon Web Services, Cloud Computing",https://www.coursera.org/learn/aws-cloud-practitioner-essentials,Amazon Web Services,Beginner Course 1 - 3 Months
427,AWS Cloud Technical Essentials,4.4,"Skills you'll gain: Amazon Web Services, Cloud Computing, Cloud Storage, Leadership and Management",https://www.coursera.org/learn/aws-cloud-technical-essentials,Amazon Web Services,Beginner Course 1 - 4 Weeks
428,AI & Law,4.4,"Skills you'll gain: Human Computer Interaction, Human Learning, Machine Learning, Applied Machine Learning, Decision Making, Machine Learning Algorithms, Business Intelligence, Leadership and Management, Process Analysis, Regulations and Compliance",https://www.coursera.org/learn/ai-law,Lund University,Beginner Course 1 - 4 Weeks
429,Forensic Accounting and Fraud Examination,4.4,"Skills you'll gain: Accounting, Audit, Critical Thinking, Financial Accounting, Risk Management, Regulations and Compliance, Data Analysis, Finance, Problem Solving, Leadership and Management",https://www.coursera.org/learn/forensic-accounting,West Virginia University,Mixed Course 1 - 3 Months
430,Electronic Music Production,4.4,,https://www.coursera.org/specializations/electronic-music-production,Berklee,Intermediate Specialization 3 - 6 Months
431,Transforming the Fashion Business,4.4,"Skills you'll gain: Leadership and Management, Research and Design, Brand Management, Design and Product, Strategy and Operations, Supply Chain Systems, Supply Chain and Logistics, Innovation, Marketing, Product Management, Collaboration, Communication, Entrepreneurship, Retail Sales, Sales, Strategy, Business Design, E-Commerce, Interactive Design, Product Lifecycle, Culture, Forecasting, Merchandising, Product Design, Visual Design",https://www.coursera.org/specializations/transforming-fashion-business,"Parsons School of Design, The New School",Intermediate Specialization 1 - 3 Months
432,Business Value and Project Management,4.7,"Skills you'll gain: Leadership and Management, Strategy and Operations, Account Management, Accounting, Finance, Financial Accounting, Financial Management, General Accounting, Project Management, Accounts Payable and Receivable, Business Process Management, Financial Analysis, Generally Accepted Accounting Principles (GAAP), Management Accounting, Cost Accounting, Decision Making, Entrepreneurship, Organizational Development, Business Design, Change Management, Leadership Development, People Management, Planning, Strategy, Culture, Operations Management, Performance Management, Problem Solving, Systems Design, Business Psychology, Human Resources",https://www.coursera.org/specializations/business-value-project-management,University of Illinois at Urbana-Champaign,Beginner Specialization 3 - 6 Months
433,Anatomy,4.7,Skills you'll gain: Human Learning,https://www.coursera.org/specializations/anatomy,University of Michigan,Beginner Specialization 3 - 6 Months
434,Business Strategies for A Better World,4.7,"Skills you'll gain: Strategy, Critical Thinking, Strategy and Operations, Leadership and Management, Decision Making, Business Analysis, Business Development, Entrepreneurship, People Development, Business Psychology, Business Transformation, Data Analysis, Organizational Development, People Analysis, Problem Solving, Business Process Management, General Statistics, Geostatistics, Planning, Human Learning, Regulations and Compliance, Basic Descriptive Statistics, Econometrics, Finance, Operations Management, Statistical Analysis",https://www.coursera.org/specializations/wharton-global-business-strategy,University of Pennsylvania,Beginner Specialization 3 - 6 Months
435,Digital Transformation Using AI/ML with Google Cloud,4.7,"Skills you'll gain: Business Transformation, Cloud Computing, Google Cloud Platform, Business Analysis, Data Analysis, Data Management, Machine Learning, Applied Machine Learning, Human Learning, Machine Learning Software, Innovation, Strategy, Strategy and Operations, Customer Analysis, Machine Learning Algorithms, Algorithms, Cloud Infrastructure, Leadership and Management, Organizational Development, Cloud Platforms, Data Architecture, Google App Engine",https://www.coursera.org/specializations/digital-transformation-using-ai-ml-with-google-cloud,Google Cloud,Beginner Specialization 3 - 6 Months
436,Trustworthy Generative AI,4.7,,https://www.coursera.org/learn/trustworthy-generative-ai,Vanderbilt University,Beginner Course 1 - 4 Weeks
437,Harnessing the Power of Data with Power BI,4.7,"Skills you'll gain: Data Analysis, Extract, Transform, Load, Power BI",https://www.coursera.org/learn/harnessing-the-power-of-data-with-power-bi,Microsoft,Beginner Course 1 - 4 Weeks
438,Investment Management,4.7,"Skills you'll gain: Finance, Investment Management, Leadership and Management, Financial Analysis, Risk Management, Financial Management, Market Analysis, Strategy, Decision Making, Behavioral Economics, Strategy and Operations, Correlation And Dependence, Performance Management, Probability & Statistics, Securities Trading, Mathematical Theory & Analysis, Statistical Analysis, Accounting",https://www.coursera.org/specializations/investment-management,University of Geneva,Beginner Specialization 3 - 6 Months
439,Payroll and Tax Fundamentals,4.7,Skills you'll gain: Taxes,https://www.coursera.org/learn/payroll-and-tax-fundamentals,"Automatic Data Processing, Inc. (ADP)",Beginner Course 1 - 4 Weeks
440,Science of Exercise,4.7,"Skills you'll gain: Health, Training",https://www.coursera.org/learn/science-exercise,University of Colorado Boulder,Beginner Course 1 - 4 Weeks
441,Photography Basics and Beyond: From Smartphone to DSLR,4.7,"Skills you'll gain: Creativity, Social Media, Operations Management, Writing",https://www.coursera.org/specializations/photography-basics,Michigan State University,Beginner Specialization 3 - 6 Months
442,Neuroscience and Neuroimaging,4.7,"Skills you'll gain: Statistical Programming, R Programming, Probability & Statistics, Data Management, Data Structures, Data Analysis, Statistical Analysis, Data Visualization, Visualization (Computer Graphics), General Statistics, Research and Design, Experiment, Correlation And Dependence, Mathematical Theory & Analysis, Process Analysis, Spatial Analysis, Spatial Data Analysis, Bioinformatics, Extract, Transform, Load, Computer Programming",https://www.coursera.org/specializations/computational-neuroscience,Johns Hopkins University,Intermediate Specialization 3 - 6 Months
443,Supply Chain Analytics,4.7,"Skills you'll gain: Data Analysis, Supply Chain Systems, Supply Chain and Logistics, Strategy and Operations, Leadership and Management, Inventory Management, Operations Management, Business Analysis, Planning, Operational Analysis, Market Analysis, Strategy, Business Intelligence, Process Analysis, Business Process Management, Forecasting, Warehouse Management, Probability & Statistics, Statistical Analysis, Customer Analysis, General Statistics, Performance Management, Statistical Visualization, Data Model, Regression, Shipping and Receiving, Statistical Tests, Supplier Relationship Management, Basic Descriptive Statistics, Financial Management, Data Visualization, Data Science",https://www.coursera.org/specializations/supply-chain-analytics,Rutgers the State University of New Jersey,Beginner Specialization 3 - 6 Months
444,Excel/VBA for Creative Problem Solving,4.8,"Skills you'll gain: Spreadsheet Software, Computer Programming, Problem Solving, Microsoft Excel, Programming Principles, Data Analysis, Critical Thinking, Algorithms, Computer Programming Tools, Computational Logic, Computational Thinking, Extract, Transform, Load",https://www.coursera.org/specializations/excel-vba-creative-problem-solving,University of Colorado Boulder,Beginner Specialization 3 - 6 Months
445,Culture-Driven Team Building,4.8,"Skills you'll gain: Leadership and Management, Collaboration, Communication, Business Psychology, Emotional Intelligence, Entrepreneurship, Culture, People Management, Strategy and Operations, Professional Development, Human Resources, Organizational Development, Human Learning",https://www.coursera.org/specializations/team-building,University of Pennsylvania,Beginner Specialization 3 - 6 Months
446,Fundraising and Development,4.8,"Skills you'll gain: Planning, Strategy, Communication, Marketing, Leadership and Management, Organizational Development, Prospecting and Qualification, Strategy and Operations, Decision Making, People Development, Business Development, Taxes",https://www.coursera.org/specializations/fundraising-development,"University of California, Davis",Beginner Specialization 3 - 6 Months
447,Social Media Management,4.8,"Skills you'll gain: Brand Management, Digital Marketing, Marketing, Media Strategy & Planning, Social Media, Strategy and Operations, Advertising, Communication, Creativity, Leadership and Management, Planning",https://www.coursera.org/learn/social-media-management,Meta,Beginner Course 1 - 4 Weeks
448,AI Applications in Marketing and Finance,4.8,"Skills you'll gain: Business Analysis, Machine Learning, Customer Analysis, Finance, Financial Accounting, Marketing, Probability & Statistics, Statistical Machine Learning, User Experience",https://www.coursera.org/learn/wharton-ai-applications-marketing-finance,University of Pennsylvania,Mixed Course 1 - 4 Weeks
449,Understanding Clinical Research: Behind the Statistics,4.8,"Skills you'll gain: Basic Descriptive Statistics, Data Analysis, General Statistics, Probability & Statistics, Statistical Tests, Critical Thinking, Clinical Data Management, Statistical Visualization",https://www.coursera.org/learn/clinical-research,University of Cape Town,Beginner Course 1 - 3 Months
450,Programming with JavaScript,4.8,"Skills you'll gain: Javascript, Front-End Web Development, Computer Programming, Web Development Tools",https://www.coursera.org/learn/programming-with-javascript,Meta,Beginner Course 1 - 3 Months
451,Creating Business Value with Data and Looker,4.8,"Skills you'll gain: Cloud Computing, Cloud Platforms, Data Analysis, Google Cloud Platform, Looker (Software), Machine Learning",https://www.coursera.org/specializations/creating-business-value-with-data-and-looker,Google Cloud,Intermediate Specialization 3 - 6 Months
452,"Introduction to Web Development with HTML, CSS, JavaScript",4.8,"Skills you'll gain: Web Development, Cloud Applications, Javascript",https://www.coursera.org/learn/introduction-to-web-development-with-html-css-javacript,IBM,Beginner Course 1 - 3 Months
453,Managerial Accounting Fundamentals,4.8,"Skills you'll gain: Accounting, Cost Accounting, Leadership and Management, Management Accounting, Account Management, Financial Accounting, Budget Management, General Accounting, Critical Thinking, Finance",https://www.coursera.org/learn/uva-darden-managerial-accounting,University of Virginia,Beginner Course 1 - 4 Weeks
454,ITIL 4 Exam Preparation,4.8,"Skills you'll gain: Organizational Development, Leadership and Management, Planning",https://www.coursera.org/learn/itil-4-exam-preparation,LearnQuest,Mixed Course 1 - 3 Months
455,Optical Engineering,4.8,"Skills you'll gain: Systems Design, Algorithms",https://www.coursera.org/specializations/optical-engineering,University of Colorado Boulder,Advanced Specialization 3 - 6 Months
456,Medical Neuroscience,4.9,Skills you'll gain: Health,https://www.coursera.org/learn/medical-neuroscience,Duke University,Advanced Course 3 - 6 Months
457,Programming with Google Go,4.9,"Skills you'll gain: Computer Programming, Programming Principles, Software Engineering, Theoretical Computer Science, Computational Thinking, Critical Thinking, Algorithms, Data Structures, Problem Solving, Computational Logic, Operating Systems, Software Architecture, System Software, Application Development, Computer Architecture",https://www.coursera.org/specializations/google-golang,"University of California, Irvine",Intermediate Specialization 3 - 6 Months
458,Google サイバーセキュリティ,4.9,,https://www.coursera.org/professional-certificates/google-cybersecurity-jp,Google,Beginner Professional Certificate 3 - 6 Months
459,Biostatistics in Public Health,4.9,"Skills you'll gain: Biostatistics, General Statistics, Probability & Statistics, Statistical Analysis, Statistical Tests, Data Analysis, Regression, Basic Descriptive Statistics, Critical Thinking, Estimation, Probability Distribution, Data Visualization, Problem Solving",https://www.coursera.org/specializations/biostatistics-public-health,Johns Hopkins University,Beginner Specialization 3 - 6 Months
460,Introduction to Public Relations and the Media,4.9,"Skills you'll gain: Communication, Public Relations, Media Strategy & Planning, Strategy, Brand Management, Leadership and Management, Marketing, Strategy and Operations, Planning, Social Media, Business Communication, Critical Thinking, Journalism",https://www.coursera.org/specializations/introduction-to-public-relations-and-the-media,University of Colorado Boulder,Beginner Specialization 3 - 6 Months
461,"Hotel Management: Distribution, Revenue and Demand Management",4.9,"Skills you'll gain: Business Analysis, Leadership and Management, Strategy and Operations, Market Analysis, Marketing, Strategy, Business Process Management, Forecasting, Media Strategy & Planning, Operations Management, Performance Management",https://www.coursera.org/specializations/hotel-management,ESSEC Business School,Beginner Specialization 3 - 6 Months
462,Blockchain,4.9,"Skills you'll gain: BlockChain, Cryptography, Finance, Algorithms, Problem Solving, Application Development, Computer Programming, Contract Management, Data Structures, Security Engineering, Critical Thinking, Programming Principles, Research and Design, Software Engineering Tools, System Security, Theoretical Computer Science, Other Programming Languages, Security Strategy",https://www.coursera.org/specializations/blockchain,University at Buffalo,Intermediate Specialization 3 - 6 Months
463,Data Visualization with Python,4.9,"Skills you'll gain: Python Programming, Computer Programming, Data Analysis, Data Visualization",https://www.coursera.org/learn/python-for-data-visualization,IBM,Intermediate Course 1 - 3 Months
464,Dynamic Public Speaking,4.9,"Skills you'll gain: Communication, Critical Thinking, Public Relations, Strategy, Business Communication, Decision Making, Human Learning, Leadership and Management, People Analysis, People Development, Planning, Problem Solving, Professional Development, Process Analysis, Storytelling, Emotional Intelligence, Writing, Influencing, Organizational Development, Creativity, Deep Learning, Leadership Development, Performance Management, Adaptability",https://www.coursera.org/specializations/public-speaking,University of Washington,Beginner Specialization 3 - 6 Months
465,Removing Barriers to Change,4.9,"Skills you'll gain: Business Psychology, Change Management, Leadership and Management, Problem Solving, Strategy, Behavioral Economics, Influencing, Marketing, Organizational Development, Strategy and Operations",https://www.coursera.org/learn/removing-barriers-to-change,University of Pennsylvania,Beginner Course 1 - 4 Weeks
466,Google Project Management (PT),4.9,"Skills you'll gain: Project Management, Process Analysis, Collaboration, Organizational Development, Communication, Decision Making, Strategy, Product Management, Business Communication, Adaptability, Agile Software Development, Change Management, Leadership and Management, People Analysis, Scrum (Software Development), Strategy and Operations, Budget Management, Continuous Integration, Risk Management, Spreadsheet Software, Professional Development, Programming Principles, Application Development, Software Engineering",https://www.coursera.org/professional-certificates/gestao-de-projetos-do-google,Google,Beginner Professional Certificate 3 - 6 Months
467,"Make the Sale: Build, Launch, and Manage E-commerce Stores",4.9,"Skills you'll gain: E-Commerce, Sales, Advertising, Digital Marketing, Marketing, Marketing Management, Media Strategy & Planning, Strategy",https://www.coursera.org/learn/make-the-sale,Google,Beginner Course 1 - 4 Weeks
468,Corporate Strategy,4.8,"Skills you'll gain: Entrepreneurship, Leadership and Management, Marketing, Sales, Strategy, Strategy and Operations, Finance, Mergers & Acquisitions, Business Development",https://www.coursera.org/learn/corporatestrategy,University of London,Beginner Course 1 - 4 Weeks
469,Managing Cybersecurity,4.8,"Skills you'll gain: Security Engineering, System Security, Risk Management, Computer Security Incident Management, Leadership and Management, Security Strategy, Network Security, Strategy, Cyberattacks, Strategy and Operations, Computer Security Models, Software Security, Security Software, Computer Networking, Planning, Regulations and Compliance, Business Analysis, Network Architecture, Networking Hardware, Operations Management, Cryptography, Network Model, Systems Design",https://www.coursera.org/specializations/managing-cybersecurity,University System of Georgia,Beginner Specialization 3 - 6 Months
470,Rust Programming,4.8,"Skills you'll gain: Computer Programming, DevOps, Machine Learning, Python Programming, Software Testing, System Programming",https://www.coursera.org/specializations/rust-programming,Duke University,Beginner Specialization 3 - 6 Months
471,Building AI Powered Chatbots Without Programming,4.8,"Skills you'll gain: Cloud Computing, Computer Programming, IBM Cloud, Machine Learning",https://www.coursera.org/learn/building-ai-powered-chatbots,IBM,Beginner Course 1 - 3 Months
472,Design a User Experience for Social Good & Prepare for Jobs,4.8,"Skills you'll gain: User Experience, Social Media, User Research, Web Design",https://www.coursera.org/learn/ux-design-jobs,Google,Beginner Course 1 - 3 Months
473,Object Oriented Programming,4.8,Skills you'll gain: Computer Programming,https://www.coursera.org/specializations/object-oriented-programming-s12n,University of London,Intermediate Specialization 1 - 3 Months
474,Construction Project Management,4.8,"Skills you'll gain: Project Management, Strategy and Operations, Leadership and Management, Operations Management, Change Management, Entrepreneurship, Planning, Supply Chain and Logistics",https://www.coursera.org/learn/construction-project-management,Columbia University,Beginner Course 1 - 3 Months
475,Customer Analytics,4.8,"Skills you'll gain: Basic Descriptive Statistics, Business Analysis, Customer Analysis, Data Analysis, Data Model, Exploratory Data Analysis, Market Analysis, Market Research, Marketing, Strategy",https://www.coursera.org/learn/wharton-customer-analytics,University of Pennsylvania,Mixed Course 1 - 3 Months
476,Introduction to Software Engineering,4.8,"Skills you'll gain: Software Engineering, Computer Programming, Software Engineering Tools, Application Development, Programming Principles, Software Architecture, Agile Software Development, Communication, Product Management, Technical Product Management, Python Programming",https://www.coursera.org/learn/introduction-to-software-engineering,IBM,Beginner Course 1 - 3 Months
477,Bioinformatics,4.8,"Skills you'll gain: Bioinformatics, Algorithms, Computer Programming, Probability & Statistics, Computational Thinking, Computational Logic, Python Programming, Theoretical Computer Science, Critical Thinking, Graph Theory, Problem Solving, Statistical Programming",https://www.coursera.org/specializations/bioinformatics,University of California San Diego,Beginner Specialization 3 - 6 Months
478,Digital Product Management: Modern Fundamentals,4.8,"Skills you'll gain: Product Management, Leadership and Management, Planning, Product Strategy, Strategy",https://www.coursera.org/learn/uva-darden-digital-product-management,University of Virginia,Beginner Course 1 - 4 Weeks
479,"Food Sustainability, Mindful Eating, and Healthy Cooking",4.8,,https://www.coursera.org/specializations/food-sustainability-mindful-eating-healthy-cooking,Stanford University,Beginner Specialization 1 - 3 Months
