,course_name,course_rating,earn_skills,course_link,institution,metadata
625,Core Java,4.7,"Skills you'll gain: Computer Programming, Java Programming, Programming Principles, Software Engineering, Computer Programming Tools, Problem Solving, Software Engineering Tools, Application Development, Data Structures, Web Development, Mathematical Theory & Analysis, Computer Networking",https://www.coursera.org/specializations/core-java,LearnQuest,Intermediate Specialization 3 - 6 Months
626,Value Chain Management,4.7,"Skills you'll gain: Leadership and Management, Accounting, Management Accounting, Account Management, Cost Accounting, Decision Making, Financial Accounting, Financial Analysis, Marketing Management, Marketing, Media Strategy & Planning, Financial Management, Strategy, General Accounting, Brand Management, Market Research, Planning, Budget Management, Communication, Sales, Market Analysis, Probability Distribution, Advertising Sales, Business Research, Probability & Statistics, Problem Solving, Operations Management",https://www.coursera.org/specializations/value-chain-management,University of Illinois at Urbana-Champaign,Intermediate Specialization 3 - 6 Months
627,Principles of Sustainable Finance,4.7,"Skills you'll gain: Finance, Risk Management, Critical Thinking, Financial Management, Leadership and Management, Strategy and Operations, Business Transformation, Decision Making, Financial Analysis, Strategy",https://www.coursera.org/learn/sustainable-finance,Erasmus University Rotterdam,Intermediate Course 1 - 3 Months
628,Digital Manufacturing & Design Technology,4.7,"Skills you'll gain: Design and Product, Leadership and Management, Product Lifecycle, Product Management, Strategy and Operations, Product Development, Business Process Management, Product Design, Supply Chain Systems, Data Management, Systems Design, Computer Networking, Supply Chain and Logistics, Human Computer Interaction, Process Analysis, Technical Product Management, Data Analysis, Project Management, System Security, Business Transformation, Cloud Computing, Cyberattacks, Operations Management, Security Engineering, Big Data, Cloud Storage, Communication, Computer Architecture, Computer Security Models, Interactive Design, Network Security, Planning, Security Software, Security Strategy, Software Security, Supplier Relationship Management, Data Analysis Software, Digital Marketing, Machine Learning, Computer Security Incident Management, Internet Of Things, Software Engineering, Exploratory Data Analysis, Business Communication, Marketing",https://www.coursera.org/specializations/digital-manufacturing-design-technology,University at Buffalo,Beginner Specialization 3 - 6 Months
629,Competitive Strategy and Organization Design,4.7,"Skills you'll gain: Strategy, Strategy and Operations, Leadership and Management, Marketing, Business Development, Business Design, Entrepreneurship, Human Resources, Organizational Development, Sales, Market Analysis, Product Strategy, Decision Making, Finance, Game Theory, Human Resources Operations, Innovation, Research and Design, Design and Product, Mergers & Acquisitions, Planning",https://www.coursera.org/specializations/competitive-strategy,Ludwig-Maximilians-Universität München (LMU),Intermediate Specialization 3 - 6 Months
630,Fundamentals of Music Theory,4.7,,https://www.coursera.org/learn/edinburgh-music-theory,The University of Edinburgh,Beginner Course 1 - 3 Months
631,The Fundamentals of Personal Finance,4.7,"Skills you'll gain: Finance, Planning, Risk Management, Financial Management, Cash Management, Accounting, Taxes",https://www.coursera.org/specializations/personal-finance-fundamentals,SoFi,Beginner Specialization 3 - 6 Months
632,Project Management: Foundations and Initiation,4.7,"Skills you'll gain: Leadership and Management, Project Management, Planning, Strategy and Operations, People Management, Performance Management, Product Management, Business Communication, Business Process Management, Strategy",https://www.coursera.org/learn/project-management-foundations-initiation,University of Colorado Boulder,Beginner Course 1 - 4 Weeks
633,C Programming with Linux,4.7,"Skills you'll gain: Computer Programming, Computer Programming Tools, Linux",https://www.coursera.org/specializations/c-programming-linux,Dartmouth College,Beginner Specialization 3 - 6 Months
634,Developing AI Applications with Python and Flask,4.7,"Skills you'll gain: Application Development, Computer Programming, Python Programming",https://www.coursera.org/learn/python-project-for-ai-application-development,IBM,Intermediate Course 1 - 4 Weeks
635,Introduction to User Experience Design,4.7,"Skills you'll gain: User Experience, User Experience Design, User Research, Customer Analysis, Design and Product, Interactive Design, Product Design, Research and Design, Decision Making, Human Computer Interaction",https://www.coursera.org/learn/user-experience-design,Georgia Institute of Technology,Beginner Course 1 - 3 Months
636,Positive Psychiatry and Mental Health,4.8,Skills you'll gain: Resilience,https://www.coursera.org/learn/positive-psychiatry,The University of Sydney,Mixed Course 1 - 3 Months
637,Using Python to Interact with the Operating System,4.8,"Skills you'll gain: Computer Programming, Python Programming",https://www.coursera.org/learn/python-operating-system,Google,Beginner Course 1 - 3 Months
638,The Power of Statistics,4.8,"Skills you'll gain: General Statistics, Probability Distribution, Python Programming, Statistical Analysis",https://www.coursera.org/learn/the-power-of-statistics,Google,Advanced Course 1 - 3 Months
639,C# Programming for Unity Game Development,4.8,"Skills you'll gain: Computer Programming, Programming Principles, Problem Solving, Software Engineering, C Programming Language Family, Computer Programming Tools, Critical Thinking, Leadership and Management, Mathematics, Data Structures",https://www.coursera.org/specializations/programming-unity-game-development,University of Colorado System,Beginner Specialization 3 - 6 Months
640,Introduction to Technical Writing,4.8,Skills you'll gain: Writing,https://www.coursera.org/learn/technical-writing-introduction,Board Infinity,Beginner Course 1 - 4 Weeks
641,Leading Diverse Teams & Organizations,4.8,"Skills you'll gain: Communication, Leadership and Management",https://www.coursera.org/learn/leading-diverse-teams-and-organizations,University of Michigan,Beginner Course 1 - 4 Weeks
642,Inspired Leadership,4.8,"Skills you'll gain: Leadership and Management, Communication, Emotional Intelligence, Leadership Development, Influencing, Human Resources, Change Management, Critical Thinking, Business Psychology, Organizational Development, Strategy, Collaboration, Entrepreneurship, Human Learning, Professional Development, People Development, Marketing, People Analysis, Negotiation",https://www.coursera.org/specializations/inspired-leadership,Case Western Reserve University,Intermediate Specialization 3 - 6 Months
643,Agile Leadership,4.8,"Skills you'll gain: Leadership and Management, Business Psychology, Entrepreneurship, Communication, Strategy and Operations, Leadership Development, Change Management, Organizational Development, Project Management, Adaptability, Collaboration, Emotional Intelligence, Human Resources, Resilience, Business Transformation, Strategy, Business Communication, Professional Development, Scrum (Software Development)",https://www.coursera.org/specializations/agile-leadership-change-management,University of Colorado System,Beginner Specialization 3 - 6 Months
644,PwC GST Taxation Executive,4.8,"Skills you'll gain: Leadership and Management, Finance, Financial Analysis, Taxes, Problem Solving",https://www.coursera.org/professional-certificates/pwc-gst-taxation-executive,PwC India,Beginner Professional Certificate 3 - 6 Months
645,Mathematics for Machine Learning: Linear Algebra,4.8,"Skills you'll gain: Algebra, Linear Algebra, Mathematics, Python Programming, Computer Programming, Machine Learning Algorithms, Problem Solving, Algorithms, Computer Programming Tools, Machine Learning",https://www.coursera.org/learn/linear-algebra-machine-learning,Imperial College London,Beginner Course 1 - 3 Months
646,Finance for Technical Managers,4.8,"Skills you'll gain: Finance, Financial Analysis, Accounting, Investment Management, Cost Accounting, Leadership and Management, Financial Accounting, Financial Management, Strategy and Operations",https://www.coursera.org/specializations/finance-for-technical-managers,University of Colorado Boulder,Beginner Specialization 3 - 6 Months
647,Artificial Intelligence: an Overview,4.8,"Skills you'll gain: Machine Learning, Leadership and Management, Algorithms, Machine Learning Algorithms, Human Computer Interaction, Human Learning, Regulations and Compliance, Reinforcement Learning, Computational Thinking, Critical Thinking, Strategy, Planning",https://www.coursera.org/specializations/artificial-intelligence-overview,Politecnico di Milano,Beginner Specialization 3 - 6 Months
648,Economics of Money and Banking,4.9,"Skills you'll gain: Banking, Finance",https://www.coursera.org/learn/money-banking,Columbia University,Mixed Course 3 - 6 Months
649,Build a Modern Computer from First Principles: From Nand to Tetris (Project-Centered Course),4.9,"Skills you'll gain: Computational Logic, Computer Architecture, Computer Programming, Hardware Design, Theoretical Computer Science, Computer Programming Tools, Critical Thinking, Problem Solving, Systems Design",https://www.coursera.org/learn/build-a-computer,Hebrew University of Jerusalem,Mixed Course 1 - 3 Months
650,Supply Chain Finance and Blockchain Technology,4.9,"Skills you'll gain: Supply Chain and Logistics, Supply Chain Systems, Finance, Accounts Payable and Receivable, Supplier Relationship Management, BlockChain, Payments, Cash Management, Financial Accounting, Financial Management, Leadership and Management, Financial Analysis, FinTech, Procurement",https://www.coursera.org/specializations/supply-chain-finance-and-blockchain-technology,New York Institute of Finance,Intermediate Specialization 3 - 6 Months
651,Addiction Treatment: Clinical Skills for Healthcare Providers,4.9,,https://www.coursera.org/learn/addiction-treatment,Yale University,Beginner Course 1 - 3 Months
652,Getting Started with Git and GitHub,4.9,"Skills you'll gain: Collaboration, Leadership and Management, Mergers & Acquisitions, Software Engineering, Software Engineering Tools",https://www.coursera.org/learn/getting-started-with-git-and-github,IBM,Beginner Course 1 - 4 Weeks
653,Natural Language Processing in TensorFlow,4.9,"Skills you'll gain: Machine Learning, Natural Language Processing, Deep Learning, Machine Learning Algorithms, Tensorflow, Python Programming, Computer Programming, Artificial Neural Networks, Machine Learning Software, Network Model",https://www.coursera.org/learn/natural-language-processing-tensorflow,DeepLearning.AI,Intermediate Course 1 - 4 Weeks
654,"Sequences, Time Series and Prediction",4.9,"Skills you'll gain: Machine Learning, Forecasting, Tensorflow, Applied Machine Learning, Deep Learning, Artificial Neural Networks, Human Learning, Machine Learning Algorithms, Statistical Analysis, Statistical Machine Learning",https://www.coursera.org/learn/tensorflow-sequences-time-series-and-prediction,DeepLearning.AI,Intermediate Course 1 - 4 Weeks
655,Vivre avec le TDAH à travers les âges,4.9,,https://www.coursera.org/learn/tdah,University of Geneva,Beginner Course 1 - 3 Months
656,Object-Oriented Data Structures in C++,4.9,"Skills you'll gain: C Programming Language Family, Computer Programming, Data Structures, Theoretical Computer Science",https://www.coursera.org/learn/cs-fundamentals-1,University of Illinois at Urbana-Champaign,Intermediate Course 1 - 4 Weeks
657,AI For Everyone （すべての人のためのAIリテラシー講座）,4.9,"Skills you'll gain: Applied Machine Learning, Deep Learning, Machine Learning, Machine Learning Software, Business Analysis, Business Process Management, Data Analysis, Human Learning, Machine Learning Algorithms, Algorithms, General Statistics",https://www.coursera.org/learn/ai-for-everyone-ja,DeepLearning.AI,Beginner Course 1 - 3 Months
658,AI Strategy and Governance,4.9,"Skills you'll gain: Machine Learning, Data Analysis, Applied Machine Learning, Business Transformation, Decision Making, Human Learning, Machine Learning Algorithms, Regulations and Compliance, Strategy",https://www.coursera.org/learn/wharton-ai-strategy-governance,University of Pennsylvania,Beginner Course 1 - 4 Weeks
659,Palliative Care Always,4.9,"Skills you'll gain: Communication, Planning, Leadership and Management",https://www.coursera.org/specializations/palliative-care-always,Stanford University,Beginner Specialization 3 - 6 Months
660,Version Control,4.6,"Skills you'll gain: Collaboration, Linux, Software Engineering, Software Engineering Tools, Web Development",https://www.coursera.org/learn/introduction-to-version-control,Meta,Beginner Course 1 - 4 Weeks
661,Business Statistics and Analysis,4.6,"Skills you'll gain: Probability & Statistics, Statistical Analysis, Business Analysis, General Statistics, Data Analysis, Spreadsheet Software, Basic Descriptive Statistics, Microsoft Excel, Statistical Tests, Probability Distribution, Business Intelligence, Data Analysis Software, Regression, Data Management, Critical Thinking, Data Visualization, Plot (Graphics), Statistical Visualization, Problem Solving",https://www.coursera.org/specializations/business-statistics-analysis,Rice University,Beginner Specialization 3 - 6 Months
662,Building Your Leadership Skills,4.6,"Skills you'll gain: Human Resources, Leadership Development, Leadership and Management, Communication, Emotional Intelligence, Adaptability, Business Psychology, Entrepreneurship",https://www.coursera.org/learn/leadership-skills,HEC Paris,Mixed Course 1 - 4 Weeks
663,International Leadership and Organizational Behavior,4.6,"Skills you'll gain: Leadership and Management, Business Psychology, Culture, Human Resources, Communication, Entrepreneurship, Leadership Development, Organizational Development, Conflict Management",https://www.coursera.org/learn/organizational-behavior,Università Bocconi,Mixed Course 1 - 3 Months
664,Antibiotic Stewardship,4.6,,https://www.coursera.org/learn/antibiotic-stewardship,Stanford University,Advanced Course 1 - 3 Months
665,AI Applications in People Management,4.6,"Skills you'll gain: Leadership and Management, Machine Learning, People Management, Algorithms, Applied Machine Learning, Human Resources, Machine Learning Algorithms, People Analysis, Decision Making",https://www.coursera.org/learn/wharton-ai-applications-people-management,University of Pennsylvania,Mixed Course 1 - 4 Weeks
666,Driving business towards the Sustainable Development Goals,4.6,"Skills you'll gain: Critical Thinking, Innovation, Leadership and Management, Problem Solving, Strategy, Business Transformation, Collaboration, Entrepreneurship, People Development, Organizational Development",https://www.coursera.org/learn/sdgbusiness,Erasmus University Rotterdam,Beginner Course 1 - 3 Months
667,Circular Economy - Sustainable Materials Management,4.6,"Skills you'll gain: Business Design, Business Transformation, Product Design, Product Strategy, Strategy, Innovation, Research and Design",https://www.coursera.org/learn/circular-economy,Lund University,Beginner Course 1 - 3 Months
668,Microsoft Azure Security Engineer Associate (AZ-500),4.6,,https://www.coursera.org/professional-certificates/microsoft-azure-security-engineer-associate,Microsoft,Intermediate Professional Certificate 3 - 6 Months
669,"Organizational Leadership in Diversity, Equity & Inclusion",4.6,"Skills you'll gain: Communication, Business Psychology, Employee Relations, Human Resources, Human Resources Operations, Leadership and Management, Culture, Entrepreneurship, Organizational Development, Business Analysis, Collaboration, Operational Analysis, People Development, Talent Management",https://www.coursera.org/specializations/organizational-leadership-in-diversity-equity-and-inclusion,Rice University,Intermediate Specialization 3 - 6 Months
670,Excel Skills for Business: Intermediate I,4.6,"Skills you'll gain: Business Analysis, Data Analysis, Microsoft Excel, Spreadsheet Software, Plot (Graphics), Databases",https://www.coursera.org/learn/excel-intermediate-1,Macquarie University,Intermediate Course 1 - 3 Months
671,"Energy Production, Distribution & Safety",4.6,,https://www.coursera.org/specializations/energy-industry,University at Buffalo,Beginner Specialization 3 - 6 Months
672,Conflict Management,4.4,"Skills you'll gain: Collaboration, Communication, Conflict Management, Leadership and Management",https://www.coursera.org/specializations/conflict-management,"University of California, Irvine",Beginner Specialization 3 - 6 Months
673,International Law in Action: the Arbitration of International Disputes,4.4,,https://www.coursera.org/learn/arbitration-international-disputes,Universiteit Leiden,Mixed Course 1 - 3 Months
674,Advanced Business Analytics,4.4,"Skills you'll gain: Data Analysis, Business Analysis, Exploratory Data Analysis, Statistical Analysis, Data Management, Probability & Statistics, Data Model, Decision Making, Data Analysis Software, General Statistics, Statistical Visualization, Data Visualization, Correlation And Dependence, Mathematics, Regression, Business Intelligence, Mathematical Theory & Analysis, Business Communication, Communication, Data Structures, Databases, Plot (Graphics), Database Application, Extract, Transform, Load, SQL",https://www.coursera.org/specializations/data-analytics-business,University of Colorado Boulder,Intermediate Specialization 3 - 6 Months
675,International Marketing & Cross Industry Growth,4.4,"Skills you'll gain: Marketing, Strategy, Leadership and Management, Customer Analysis, Market Analysis, Marketing Management, Product Marketing, Brand Management, Customer Relationship Management, Marketing Design, Media Strategy & Planning, Product Strategy, Product Management, Strategy and Operations, B2B Sales, Social Media, Communication, Creativity, Market Research, Operations Management, Sales",https://www.coursera.org/specializations/international-marketing,Yonsei University,Beginner Specialization 3 - 6 Months
676,Corporate Sustainability. Understanding and Seizing the Strategic Opportunity,4.4,"Skills you'll gain: Leadership and Management, Organizational Development, Strategy, Strategy and Operations, Business Transformation, Critical Thinking, Business Process Management, Change Management, Employee Relations, Innovation",https://www.coursera.org/learn/corp-sustainability,Università Bocconi,Mixed Course 1 - 3 Months
677,Accounting: Principles of Financial Accounting,4.4,"Skills you'll gain: Accounting, Financial Accounting, Finance",https://www.coursera.org/learn/financial-accounting,IESE Business School,Beginner Course 1 - 4 Weeks
678,Supply Chain Logistics,4.4,"Skills you'll gain: Continuous Delivery, Inventory Management, Leadership and Management, Planning, Strategy and Operations, Supplier Relationship Management, Supply Chain Systems, Supply Chain and Logistics, Transportation Operations Management, Warehouse Management",https://www.coursera.org/learn/supply-chain-logistics,Rutgers the State University of New Jersey,Beginner Course 1 - 4 Weeks
679,Cybersecurity Operations Fundamentals,4.4,"Skills you'll gain: Network Security, Operations Management",https://www.coursera.org/specializations/cbrops,Cisco Learning and Certifications,Beginner Specialization 3 - 6 Months
680,Medical Terminology I,4.4,,https://www.coursera.org/learn/medical-terminology-1,Rice University,Beginner Course 1 - 3 Months
681,Oil & Gas Industry Operations and Markets,4.4,,https://www.coursera.org/learn/oilandgas,Duke University,Mixed Course 1 - 4 Weeks
682,The Principles of Real Estate,4.4,,https://www.coursera.org/learn/the-principles-of-real-estate,Keller Williams,Beginner Course 1 - 3 Months
683,First Principles of Computer Vision,4.4,"Skills you'll gain: Computer Vision, Mathematics, Algebra, Algorithms, Computational Thinking",https://www.coursera.org/specializations/firstprinciplesofcomputervision,Columbia University,Beginner Specialization 3 - 6 Months
684,Foundations of Software Testing and Validation,4.6,Skills you'll gain: Software Testing,https://www.coursera.org/learn/foundations-of-software-testing-and-validation,University of Leeds,Beginner Course 1 - 4 Weeks
685,Tally Bookkeeper,4.6,"Skills you'll gain: Accounting Software, Accounting, Finance, Financial Accounting, General Accounting, Data Management, Taxes, Billing & Invoicing, Cash Management, Cost Accounting, Inventory Management, Supply Chain and Logistics, Financial Management, Payments, Accounts Payable and Receivable, Business Analysis, Data Analysis, Financial Analysis, Banking, Budget Management, Corporate Accouting, Data Architecture, Shipping and Receiving",https://www.coursera.org/professional-certificates/tally-bookkeeper,Tally Education and Distribution Services Private Limited,Beginner Professional Certificate 3 - 6 Months
686,Deep Neural Networks with PyTorch,4.6,"Skills you'll gain: Human Learning, Machine Learning, Deep Learning, Python Programming, Artificial Neural Networks, Machine Learning Algorithms, Applied Machine Learning, Algorithms, Regression, Statistical Machine Learning",https://www.coursera.org/learn/deep-neural-networks-with-pytorch,IBM,Intermediate Course 1 - 3 Months
687,Entrepreneurial Finance: Strategy and Innovation,4.6,"Skills you'll gain: Finance, Entrepreneurial Finance, Risk Management, Probability & Statistics, R Programming, Entrepreneurship, Data Analysis, Investment Management, Statistical Analysis, Statistical Programming, Financial Analysis, Leadership and Management, BlockChain, Cryptography, FinTech, Statistical Tests, Financial Management, Algorithms, Innovation, System Security, Microsoft Excel",https://www.coursera.org/specializations/entrepreneurial-finance,Duke University,Intermediate Specialization 3 - 6 Months
688,Fractal Data Science,4.6,"Skills you'll gain: Communication, Critical Thinking, Data Analysis, Data Model, Data Visualization, Exploratory Data Analysis, Feature Engineering, Power BI, Problem Solving, SQL, Storytelling",https://www.coursera.org/professional-certificates/fractal-data-science,Fractal Analytics,Beginner Professional Certificate 3 - 6 Months
689,Leverage Data Science for a More Agile Supply Chain,4.6,"Skills you'll gain: Inventory Management, Data Analysis, Supply Chain Systems, Leadership and Management, Business Analysis, Forecasting, Supply Chain and Logistics",https://www.coursera.org/specializations/leverage-data-science-agile-supply-chain,"University of California, Irvine",Intermediate Specialization 1 - 3 Months
690,"Strategic Leadership: Impact, Change, and Decision-Making",4.6,"Skills you'll gain: Leadership and Management, Critical Thinking, Leadership Development, Decision Making, Professional Development, Strategy, Strategy and Operations, People Development, People Management, People Analysis, Organizational Development, Problem Solving, Talent Management, Communication, Emotional Intelligence, Change Management, Human Resources, Business Analysis, Business Psychology, Entrepreneurship, Research and Design, Creativity, Influencing",https://www.coursera.org/specializations/strategic-leadership-impact-change-decision-making,Dartmouth College,Beginner Specialization 3 - 6 Months
691,Trading Strategies in Emerging Markets,4.6,"Skills you'll gain: Finance, Investment Management, Financial Analysis, Securities Trading, Accounting, Algorithms, Strategy, Financial Accounting, Market Analysis, Business Analysis, Statistical Analysis, Strategy and Operations, Account Management, Accounts Payable and Receivable, Data Analysis, General Accounting, Performance Management, Cash Management, Correlation And Dependence, Critical Thinking",https://www.coursera.org/specializations/trading-strategy,Indian School of Business,Beginner Specialization 3 - 6 Months
692,Introduction to Computers and Operating Systems and Security,4.6,"Skills you'll gain: Cloud Computing, Computer Architecture, Operating Systems, System Security",https://www.coursera.org/learn/introduction-to-computers-and-operating-systems-and-security,Microsoft,Beginner Course 1 - 4 Weeks
693,Habilidades Gerenciales,4.6,"Skills you'll gain: Leadership and Management, Organizational Development, Strategy, Human Resources, Communication, Strategy and Operations, Emotional Intelligence, People Analysis, Project Management, Collaboration, Human Learning, Planning, Adaptability, Business Process Management, Business Psychology, Persona Research, Change Management, Leadership Development, Operational Analysis, Business Analysis, Media Strategy & Planning, Talent Management, Human Resources Operations, Problem Solving",https://www.coursera.org/specializations/habilidades,Universidad Nacional Autónoma de México,Beginner Specialization 3 - 6 Months
694,Introduction to Sustainability,4.6,,https://www.coursera.org/learn/sustainability,University of Illinois at Urbana-Champaign,Mixed Course 1 - 3 Months
695,From Excel to Power BI,4.6,"Skills you'll gain: Data Analysis, Data Model, Data Visualization, Microsoft Excel, Power BI",https://www.coursera.org/learn/from-excel-to-power-bi,Knowledge Accelerators,Beginner Course 1 - 4 Weeks
696,Learn English: Beginning Grammar,4.9,"Skills you'll gain: Writing, Communication",https://www.coursera.org/specializations/learn-english-beginning-grammar,"University of California, Irvine",Beginner Specialization 1 - 3 Months
