,course_name,course_rating,earn_skills,course_link,institution,metadata
216,Introduction to Negotiation: A Strategic Playbook for Becoming a Principled and Persuasive Negotiator,4.9,"Skills you'll gain: Negotiation, Game Theory, Strategy",https://www.coursera.org/learn/negotiation,Yale University,Mixed Course 1 - 3 Months
217,Getting started with Google Workspace,4.9,"Skills you'll gain: Collaboration, Google Cloud Platform, Communication, Cloud Applications, User Experience, Cloud Platforms, Leadership and Management, Cloud Computing, Business Communication, Organizational Development, Google App Engine, Cloud Storage, Data Management, Planning, Problem Solving, Business Analysis, People Management, Spreadsheet Software, Business Process Management, Data Visualization, Other Cloud Platforms and Tools, Project Management, Writing, Professional Development, Data Analysis, Strategy, Exploratory Data Analysis, Design and Product, Visual Design, Graphic Design",https://www.coursera.org/specializations/getting-started-with-google-workspace,Google Cloud,Beginner Specialization 3 - 6 Months
218,Business Analytics with Excel: Elementary to Advanced,4.9,"Skills you'll gain: Business Analysis, Data Analysis, Data Visualization, Spreadsheet Software, Data Model, Decision Making, Microsoft Excel, Process Analysis, Statistical Visualization",https://www.coursera.org/learn/business-analytics-excel,Johns Hopkins University,Intermediate Course 1 - 3 Months
219,Mathematics for Machine Learning,4.9,"Skills you'll gain: Algebra, Linear Algebra, Mathematics, Machine Learning, Mathematical Theory & Analysis, Computer Programming, Python Programming, Machine Learning Algorithms, Calculus, Computational Logic, Algorithms, Differential Equations, Applied Mathematics, Problem Solving, Statistical Analysis, Dimensionality Reduction, Computer Programming Tools, Regression",https://www.coursera.org/specializations/mathematics-machine-learning,Imperial College London,Beginner Specialization 3 - 6 Months
220,Preparation for CompTIA A+ Certification,4.9,"Skills you'll gain: Linux, Operating Systems",https://www.coursera.org/specializations/preparation-comptia-certification,IBM,Intermediate Specialization 3 - 6 Months
221,TensorFlow: Advanced Techniques,4.9,"Skills you'll gain: Deep Learning, Machine Learning, Tensorflow, Artificial Neural Networks, Applied Machine Learning, Python Programming, Machine Learning Algorithms, Human Learning, Computer Vision, Computer Programming, Network Model, Machine Learning Software, Network Architecture, Training, Visualization (Computer Graphics), Strategy",https://www.coursera.org/specializations/tensorflow-advanced-techniques,DeepLearning.AI,Intermediate Specialization 3 - 6 Months
222,Achieving Personal and Professional Success,4.9,"Skills you'll gain: Communication, Human Learning, Professional Development, Critical Thinking, Leadership Development, Leadership and Management, People Analysis, Decision Making, Emotional Intelligence, People Development, Adaptability, Negotiation, Influencing, Innovation",https://www.coursera.org/specializations/wharton-success,University of Pennsylvania,Beginner Specialization 3 - 6 Months
223,UI / UX Design,4.9,"Skills you'll gain: Critical Thinking, Design and Product, Front-End Web Development, Graphic Design, Human Computer Interaction, Interactive Design, User Experience, User Experience Design, Visual Design, Web Design, Strategy",https://www.coursera.org/specializations/ui-ux-design,California Institute of the Arts,Beginner Specialization 3 - 6 Months
224,Google Project Management,4.9,"Skills you'll gain: Leadership and Management, Planning, Communication, Strategy, Strategy and Operations, Business Analysis, Business Development, Business Psychology, Collaboration, Decision Making, Design and Product, Data Analysis, Entrepreneurship, Business Communication, Conflict Management, Emotional Intelligence, People Management, Resilience, Compensation, People Analysis, Network Security, Data Analysis Software, Adaptability, Organizational Development, Project Management, Culture",https://www.coursera.org/professional-certificates/gestion-de-projet-google,Google,Beginner Professional Certificate 3 - 6 Months
225,Management of Fashion and Luxury Companies,4.9,"Skills you'll gain: Brand Management, Leadership and Management, Marketing, Retail Sales, Strategy, Communication, Customer Analysis, Design and Product, Market Analysis, Media Strategy & Planning, Product Design",https://www.coursera.org/learn/mafash,Università Bocconi,Mixed Course 1 - 3 Months
226,Private Equity and Venture Capital,4.9,"Skills you'll gain: Business Analysis, Entrepreneurial Finance, Finance, Financial Management, Investment Management, Mergers & Acquisitions, Entrepreneurship, Decision Making, Financial Analysis, Leadership and Management",https://www.coursera.org/learn/private-equity,Università Bocconi,Mixed Course 1 - 3 Months
227,Organizational Analysis,4.9,"Skills you'll gain: Leadership and Management, Organizational Development, Strategy, Strategy and Operations, Decision Making, Business Psychology, Change Management, Culture, Business Analysis, People Analysis",https://www.coursera.org/learn/organizational-analysis,Stanford University,Beginner Course 1 - 3 Months
228,Modern and Contemporary Art and Design,4.8,"Skills you'll gain: Design and Product, Critical Thinking, Creativity",https://www.coursera.org/specializations/modern-contemporary-art-design,The Museum of Modern Art,Beginner Specialization 3 - 6 Months
229,Preparing for Google Cloud Certification: Machine Learning Engineer,4.8,"Skills you'll gain: Machine Learning, Google Cloud Platform, Applied Machine Learning, Human Learning, Cloud Computing, Machine Learning Software, Cloud Platforms, Machine Learning Algorithms, Deep Learning, Tensorflow, Feature Engineering, Artificial Neural Networks, Training, DevOps, Exploratory Data Analysis, Python Programming, Cloud-Based Integration, Data Analysis, Data Visualization, Probability & Statistics, Statistical Programming, Big Data, Regression, Statistical Visualization, SQL, Algorithms, Continuous Integration, Cloud API, Apache, Extract, Transform, Load, Docker (Software)",https://www.coursera.org/professional-certificates/preparing-for-google-cloud-machine-learning-engineer-professional-certificate,Google Cloud,Intermediate Professional Certificate 3 - 6 Months
230,Risk Management,4.8,"Skills you'll gain: Leadership and Management, Risk Management, Finance, Probability & Statistics, Strategy, Financial Analysis, Strategy and Operations, Operations Management, Statistical Tests, Business Analysis, Business Process Management, Operational Analysis, Market Analysis, Financial Management, Statistical Analysis, Regulations and Compliance, Banking, General Statistics, Operating Systems, Operations Research, Critical Thinking, Probability Distribution, Market Research",https://www.coursera.org/specializations/risk-management,New York Institute of Finance,Beginner Specialization 3 - 6 Months
231,Introduction to Social Media Marketing,4.8,"Skills you'll gain: Communication, Marketing, Digital Marketing, Social Media, Media Strategy & Planning, Advertising, Entrepreneurship, Marketing Management",https://www.coursera.org/learn/social-media-marketing-introduction,Meta,Beginner Course 1 - 3 Months
232,Accelerated Computer Science Fundamentals,4.8,"Skills you'll gain: Computer Programming, C Programming Language Family, Data Structures, Algorithms, C++ Programming, Theoretical Computer Science, Programming Principles, Computational Thinking, Problem Solving, Computer Programming Tools, Critical Thinking, Computational Logic, Graph Theory",https://www.coursera.org/specializations/cs-fundamentals,University of Illinois at Urbana-Champaign,Intermediate Specialization 1 - 3 Months
233,Project Management,4.8,"Skills you'll gain: Leadership and Management, Project Management, Planning, Strategy and Operations, Product Management, Agile Software Development, People Management, Strategy, Scrum (Software Development), Performance Management, Risk Management, Business Process Management, Business Communication, Decision Making, Adaptability, Product Development, Data Analysis, Estimation, Budget Management",https://www.coursera.org/specializations/meem-project-management,University of Colorado Boulder,Beginner Specialization 1 - 3 Months
234,Fundamentals of Quantitative Modeling,4.8,"Skills you'll gain: Business Analysis, Data Model, Finance, Forecasting, General Statistics, Mathematical Theory & Analysis, Probability & Statistics, Regression, Statistical Analysis, Basic Descriptive Statistics",https://www.coursera.org/learn/wharton-quantitative-modeling,University of Pennsylvania,Mixed Course 1 - 4 Weeks
235,From Likes to Leads: Interact with Customers Online,4.8,"Skills you'll gain: Digital Marketing, Marketing, Marketing Management, Media Strategy & Planning, Social Media, Advertising, Data Analysis, Strategy",https://www.coursera.org/learn/from-likes-to-leads,Google,Beginner Course 1 - 3 Months
236,Fintech: Foundations & Applications of Financial Technology,4.8,"Skills you'll gain: FinTech, Finance, BlockChain, Innovation, Investment Management, Financial Management, Financial Analysis, Risk Management, General Statistics, Payments, Algorithms, Behavioral Economics, Entrepreneurial Finance, Market Research, Cryptography, Customer Analysis, Human Learning, Machine Learning Algorithms, Machine Learning Software, Securities Trading, System Security, Applied Machine Learning, Machine Learning, Product Strategy, Business Transformation",https://www.coursera.org/specializations/wharton-fintech,University of Pennsylvania,Beginner Specialization 3 - 6 Months
237,Project Management & Other Tools for Career Development,4.8,"Skills you'll gain: Project Management, Communication, Collaboration, Decision Making, Leadership and Management, Strategy and Operations, Business Communication, People Management, Problem Solving, Business Analysis, Conflict Management, Critical Thinking, Professional Development, Customer Relationship Management, Negotiation, Writing, Deep Learning, Planning, Business Research, Benefits, Correlation And Dependence, Data Visualization Software, Exploratory Data Analysis, Risk Management, Scrum (Software Development)",https://www.coursera.org/specializations/project-management-success,"University of California, Irvine",Beginner Specialization 3 - 6 Months
238,Methods and Statistics in Social Sciences,4.8,"Skills you'll gain: Probability & Statistics, Statistical Tests, General Statistics, Statistical Analysis, Correlation And Dependence, Statistical Programming, Basic Descriptive Statistics, Research and Design, Data Analysis, Regression, Adaptability, Computational Thinking, Critical Thinking, People Analysis, Theoretical Computer Science, Writing, Probability Distribution, Problem Solving, R Programming, Experiment, Mathematical Theory & Analysis, Computer Programming",https://www.coursera.org/specializations/social-science,University of Amsterdam,Beginner Specialization 3 - 6 Months
239,Leading People and Teams,4.8,"Skills you'll gain: Human Resources, Leadership and Management, People Development, Strategy and Operations, Leadership Development, Talent Management, Business Psychology, People Analysis, Communication, People Management, Strategy, Human Learning, Human Resources Operations, Business Communication, Collaboration, Influencing, Performance Management, Conflict Management, Business Analysis, Marketing, Recruitment",https://www.coursera.org/specializations/leading-teams,University of Michigan,Beginner Specialization 3 - 6 Months
240,System Administration and IT Infrastructure Services,4.7,"Skills you'll gain: Cloud Computing, Leadership and Management",https://www.coursera.org/learn/system-administration-it-infrastructure-services,Google,Beginner Course 1 - 3 Months
241,Foundations of Data Science,4.7,"Skills you'll gain: Communication, Data Analysis, Planning, Project Management",https://www.coursera.org/learn/foundations-of-data-science,Google,Advanced Course 1 - 3 Months
242,Intellectual Property Law,4.7,"Skills you'll gain: Critical Thinking, Strategy, Innovation, Brand Management, Leadership and Management, Marketing, Strategy and Operations, Design and Product",https://www.coursera.org/specializations/introduction-intellectual-property,University of Pennsylvania,Intermediate Specialization 3 - 6 Months
243,Capstone: Applying Project Management in the Real World,4.7,"Skills you'll gain: Communication, Leadership and Management, Planning, Problem Solving, Project Management",https://www.coursera.org/learn/applying-project-management,Google,Beginner Course 1 - 4 Weeks
244,Cybersécurité Google,4.7,"Skills you'll gain: Linux, SQL",https://www.coursera.org/professional-certificates/cybersecurite-google,Google,Beginner Professional Certificate 3 - 6 Months
245,Data Analysis with R Programming,4.7,"Skills you'll gain: R Programming, Data Analysis, Computer Programming, Data Visualization, SQL",https://www.coursera.org/learn/data-analysis-r,Google,Beginner Course 1 - 3 Months
246,Machine Learning with Python,4.7,"Skills you'll gain: Machine Learning, Algorithms, Data Analysis, Human Learning, Python Programming, Regression",https://www.coursera.org/learn/machine-learning-with-python,IBM,Intermediate Course 1 - 3 Months
247,Machine Learning on Google Cloud,4.7,"Skills you'll gain: Machine Learning, Applied Machine Learning, Google Cloud Platform, Human Learning, Machine Learning Software, Cloud Computing, Machine Learning Algorithms, Deep Learning, Cloud Platforms, Artificial Neural Networks, Feature Engineering, Exploratory Data Analysis, Tensorflow, Python Programming, Data Analysis, Data Visualization, Probability & Statistics, Regression, Statistical Programming, Statistical Visualization, Algorithms, SQL, Cloud API, Apache, Extract, Transform, Load",https://www.coursera.org/specializations/machine-learning-tensorflow-gcp,Google Cloud,Intermediate Specialization 3 - 6 Months
248,Career Success,4.7,"Skills you'll gain: Leadership and Management, Professional Development, Strategy and Operations, Business Communication, Adaptability, Business Analysis, Communication, Decision Making, Project Management, People Management, Critical Thinking, Collaboration, Customer Relationship Management, Strategy, Planning, Business Development, Operational Analysis, Problem Solving, Accounting, Change Management, Conflict Management, Financial Accounting, Leadership Development, Organizational Development, Entrepreneurship, People Development, Business Research, Deep Learning, Finance, Financial Management, General Accounting, Generally Accepted Accounting Principles (GAAP), Negotiation, Financial Analysis, Writing, Benefits, Correlation And Dependence, Entrepreneurial Finance, Data Visualization Software, Exploratory Data Analysis, Marketing, Scrum (Software Development), Estimation",https://www.coursera.org/specializations/career-success,"University of California, Irvine",Beginner Specialization 3 - 6 Months
249,Creative Writing,4.7,"Skills you'll gain: Creativity, Human Learning, Storytelling, Writing",https://www.coursera.org/specializations/creative-writing,Wesleyan University,Beginner Specialization 3 - 6 Months
250,Clinical Trials Operations,4.7,"Skills you'll gain: Leadership and Management, Data Management, Clinical Data Management, Operations Management, Communication, Data Analysis, Recruitment, Statistical Analysis",https://www.coursera.org/specializations/clinical-trials-operations,Johns Hopkins University,Beginner Specialization 3 - 6 Months
251,Introduction to Cloud Computing,4.7,"Skills you'll gain: Cloud Computing, Cloud Applications, Cloud Infrastructure, Cloud Platforms, Cloud Storage, DevOps, IBM Cloud",https://www.coursera.org/learn/introduction-to-cloud,IBM,Beginner Course 1 - 3 Months
252,Project Management Principles and Practices,4.7,"Skills you'll gain: Project Management, Strategy and Operations, Leadership and Management, Collaboration, Communication, Conflict Management, Risk Management, Estimation, Planning",https://www.coursera.org/specializations/project-management,"University of California, Irvine",Beginner Specialization 3 - 6 Months
253,Applied Data Science with Python,4.7,"Skills you'll gain: Python Programming, Data Analysis, Computer Programming, Machine Learning, Algorithms, Applied Machine Learning, Data Mining, Machine Learning Algorithms, Exploratory Data Analysis, Statistical Programming, Data Management, Extract, Transform, Load, Natural Language Processing, Critical Thinking, Statistical Machine Learning, Graph Theory, Network Analysis, Computer Programming Tools, Human Learning, Data Visualization, Network Model, Data Analysis Software, Regression, Computer Networking, General Statistics, Network Architecture, Plot (Graphics), Visualization (Computer Graphics), Computer Graphics",https://www.coursera.org/specializations/data-science-python,University of Michigan,Intermediate Specialization 3 - 6 Months
254,Introduction to Healthcare,4.7,,https://www.coursera.org/learn/intro-to-healthcare,Stanford University,Beginner Course 1 - 3 Months
255,U.S. Federal Taxation,4.7,"Skills you'll gain: Taxes, Accounting, Financial Accounting, Finance, Critical Thinking, General Accounting, Regulations and Compliance, Financial Analysis, Corporate Accouting, Generally Accepted Accounting Principles (GAAP), Problem Solving, Benefits",https://www.coursera.org/specializations/united-states-federal-taxation,University of Illinois at Urbana-Champaign,Intermediate Specialization 3 - 6 Months
256,Databases and SQL for Data Science with Python,4.7,"Skills you'll gain: Python Programming, Computer Programming, Data Analysis, Data Analysis Software, Data Management, Database Administration, Database Application, Databases, SQL, Cloud Computing, IBM Cloud",https://www.coursera.org/learn/sql-data-science,IBM,Beginner Course 1 - 3 Months
257,Agile Development,4.7,"Skills you'll gain: Agile Software Development, Design and Product, Leadership and Management, Product Management, Software Engineering, Product Development, Project Management, User Experience, Customer Analysis, Product Design, Research and Design, Data Analysis, Strategy and Operations, Business Analysis, Communication, Continuous Delivery",https://www.coursera.org/specializations/agile-development,University of Virginia,Beginner Specialization 3 - 6 Months
258,Software Product Management,4.7,"Skills you'll gain: Software Engineering, Agile Software Development, Product Management, Design and Product, Leadership and Management, Project Management, Planning, Application Development, Product Design, Entrepreneurship, Strategy and Operations, Business Analysis, Collaboration, User Experience, Scrum (Software Development), Supply Chain and Logistics",https://www.coursera.org/specializations/product-management,University of Alberta,Beginner Specialization 3 - 6 Months
259,Introduction to Machine Learning in Production,4.7,"Skills you'll gain: Machine Learning, Applied Machine Learning, Leadership and Management",https://www.coursera.org/learn/introduction-to-machine-learning-in-production,DeepLearning.AI,Advanced Course 1 - 4 Weeks
260,Data Visualization with Tableau,4.7,"Skills you'll gain: Data Visualization, Data Analysis, Data Analysis Software, Data Visualization Software, Tableau Software, Business Analysis, Business Intelligence, Statistical Visualization, Exploratory Data Analysis, Interactive Data Visualization, Interactive Design, Software Visualization, Storytelling, Visual Design, Visualization (Computer Graphics), Plot (Graphics), Computer Graphics",https://www.coursera.org/specializations/data-visualization,"University of California, Davis",Beginner Specialization 3 - 6 Months
261,Sound the Alarm: Detection and Response,4.7,"Skills you'll gain: Linux, Network Security, Computer Security Incident Management, Leadership and Management",https://www.coursera.org/learn/detection-and-response,Google,Beginner Course 1 - 4 Weeks
262,Work Smarter with Microsoft Word,4.7,"Skills you'll gain: Collaboration, Communication, Computer Graphics, Microsoft Excel, Visual Design, Research and Design, Writing, Interactive Data Visualization, Software Architecture, User Experience Design",https://www.coursera.org/learn/microsoft-word-work-smarter,Microsoft,Beginner Course 1 - 3 Months
263,Share Data Through the Art of Visualization,4.7,"Skills you'll gain: Business Communication, Data Analysis, Data Visualization, Data Visualization Software, Tableau Software",https://www.coursera.org/learn/visualize-data,Google,Beginner Course 1 - 4 Weeks
264,Foundations of Business Intelligence,4.7,"Skills you'll gain: Business Intelligence, Data Analysis, Leadership and Management",https://www.coursera.org/learn/foundations-of-business-intelligence,Google,Advanced Course 1 - 4 Weeks
265,Generative AI: Introduction and Applications,4.7,Skills you'll gain: Natural Language Processing,https://www.coursera.org/learn/generative-ai-introduction-and-applications,IBM,Beginner Course 1 - 4 Weeks
266,GPT Vision: Seeing the World through Generative AI,4.7,,https://www.coursera.org/learn/gpt-vision,Vanderbilt University,Beginner Course 1 - 4 Weeks
267,Scrum Master Certification,4.7,"Skills you'll gain: Agile Software Development, Scrum (Software Development), Project Management, Software Engineering, Continuous Delivery, Product Development, Continuous Integration, Leadership and Management, Product Management, Collaboration, DevOps, Software Testing, Application Development, Product Lifecycle, Planning, Process Analysis, System Software, Devops Tools, Risk Management",https://www.coursera.org/specializations/learnquest-certified-scrum-master,LearnQuest,Beginner Specialization 3 - 6 Months
268,AI Fundamentals for Non-Data Scientists,4.7,"Skills you'll gain: Machine Learning, Machine Learning Algorithms, Artificial Neural Networks, Data Analysis, Deep Learning, Human Learning, Big Data",https://www.coursera.org/learn/wharton-ai-fundamentals-non-data-scientists,University of Pennsylvania,Mixed Course 1 - 4 Weeks
269,IBM Mainframe Developer,4.7,"Skills you'll gain: Computer Programming, Other Programming Languages, Software Engineering, Theoretical Computer Science, Computer Architecture",https://www.coursera.org/professional-certificates/ibm-mainframe-developer,IBM,Intermediate Professional Certificate 3 - 6 Months
270,"Product Ideation, Design, and Management",4.7,"Skills you'll gain: Leadership and Management, Design and Product, Strategy and Operations, Product Management, Entrepreneurship, Product Development, Strategy, Product Design, Marketing, Product Strategy, Research and Design, Market Research, Market Analysis, Product Marketing, Finance, Sales, Decision Making, Investment Management, Planning, Project Management, Financial Analysis, Financial Management, Business Psychology, Budget Management, Customer Analysis, Entrepreneurial Finance, Software Engineering Tools, Innovation",https://www.coursera.org/specializations/product-ideation-design-and-management,"University of Maryland, College Park",Beginner Specialization 3 - 6 Months
271,AI for Good,4.7,"Skills you'll gain: Artificial Neural Networks, Computer Vision, Exploratory Data Analysis, Machine Learning, Natural Language Processing, Python Programming",https://www.coursera.org/specializations/ai-for-good,DeepLearning.AI,Beginner Specialization 1 - 3 Months
272,AI for Medicine,4.7,"Skills you'll gain: Machine Learning, Machine Learning Algorithms, Deep Learning, Python Programming, Artificial Neural Networks, Statistical Programming, Probability & Statistics, Natural Language Processing",https://www.coursera.org/specializations/ai-for-medicine,DeepLearning.AI,Intermediate Specialization 1 - 3 Months
273,"Influencing: Storytelling, Change Management and Governance",4.7,"Skills you'll gain: Leadership and Management, Communication, Business Psychology, Conflict Management, Strategy and Operations, Change Management, Influencing, Organizational Development, Risk Management, Marketing, Negotiation, Sales, Critical Thinking, Decision Making, Entrepreneurship, Human Resources, Probability & Statistics, Business Communication, Employee Relations, Data Analysis, People Analysis, Statistical Tests, Storytelling",https://www.coursera.org/specializations/influencing-storytelling-change-management,Macquarie University,Beginner Specialization 3 - 6 Months
274,Medical Terminology,4.7,Skills you'll gain: Human Learning,https://www.coursera.org/specializations/medicalterminology,Rice University,Beginner Specialization 3 - 6 Months
275,Google Data Analytics (PT),4.7,"Skills you'll gain: Data Analysis, Data Visualization, Exploratory Data Analysis, Process Analysis, Databases, Data Management, Extract, Transform, Load, Statistical Programming, SQL, Business Analysis, Spreadsheet Software, Operational Analysis, Data Analysis Software, Microsoft Excel, Visualization (Computer Graphics), Communication, Critical Thinking, Interactive Data Visualization, Programming Principles, Statistical Visualization, Big Data, Collaboration, Organizational Development, Plot (Graphics), R Programming, Strategy, Tableau Software, Decision Making, Storytelling, Strategy and Operations, Graph Theory, Project Management, Data Structures, Leadership and Management, Security Engineering, System Security, Persona Research, Journalism",https://www.coursera.org/professional-certificates/analise-de-dados-do-google,Google,Beginner Professional Certificate 3 - 6 Months
276,Build Wireframes and Low-Fidelity Prototypes,4.9,"Skills you'll gain: Product Design, User Experience, User Research",https://www.coursera.org/learn/wireframes-low-fidelity-prototypes,Google,Beginner Course 1 - 4 Weeks
